{
  "id": "million-seconds-scale",
  "claim_type": "calculation",
  "statement": "One million seconds is about 11.57 days; one billion seconds is about 31.7 years using 365-day years.",
  "retrieved_at": "2026-09-13T18:00:00.000Z",
  "confidence": "high",
  "rights_status": "original_calculation",
  "expiry_or_recheck": null,
  "calculation": {
    "inputs": {
      "million_seconds": 1000000,
      "billion_seconds": 1000000000,
      "seconds_per_day": 86400,
      "days_per_year": 365
    },
    "formula": "days = seconds / 86400; years_365d = seconds / (86400 * 365)",
    "result": {
      "million_days": 11.574074074074074,
      "billion_years_365d": 31.709791983764504
    },
    "units": "mixed"
  },
  "sources": [
    {
      "url": "https://www.nist.gov/pml/special-publication-811/nist-guide-si-chapter-5-units-outside-si",
      "title": "NIST Guide to the SI, Chapter 5: Units Outside the SI",
      "publisher": "National Institute of Standards and Technology",
      "accessed_at": "2026-09-13T18:00:00.000Z",
      "locator": "time units / day definition context",
      "excerpt": "A day is commonly treated as 86400 seconds for civil time calculations; leap seconds are a separate concern."
    }
  ],
  "notes": "This is an arithmetic illustration for agents, not a legal or calendar authority. Leap seconds are ignored."
}
